{
  "$schema": "../schemas/dependency-license-evidence.schema.json",
  "schemaVersion": 1,
  "status": "passed",
  "reasonCode": null,
  "lockDigest": "sha256:0ad414081b5f8a77ffa607f4365efa0ee6003fbbe5326cbea33930a397f48e7e",
  "policyDigest": "sha256:42d400104ec7172da86281a912d4329403e9bac682e067b5e099fc7d939acb8c",
  "scope": {
    "root": true,
    "workspaces": true,
    "direct": true,
    "transitive": true,
    "development": true,
    "runtimeDistributed": false
  },
  "packages": [
    {
      "path": ".",
      "name": "llm-plugins-fusion-maintenance",
      "version": "4.0.0",
      "direct": true,
      "workspace": false,
      "development": true,
      "optional": false,
      "licenseExpression": "MIT",
      "ast": {
        "license": "MIT"
      },
      "status": "passed",
      "reasonCode": null
    },
    {
      "path": "node_modules/@types/node",
      "name": "@types/node",
      "version": "22.20.1",
      "direct": true,
      "workspace": false,
      "development": true,
      "optional": false,
      "licenseExpression": "MIT",
      "ast": {
        "license": "MIT"
      },
      "status": "passed",
      "reasonCode": null
    },
    {
      "path": "node_modules/@typescript/typescript-aix-ppc64",
      "name": "@typescript/typescript-aix-ppc64",
      "version": "7.0.2",
      "direct": false,
      "workspace": false,
      "development": true,
      "optional": true,
      "licenseExpression": "Apache-2.0",
      "ast": {
        "license": "Apache-2.0"
      },
      "status": "passed",
      "reasonCode": null
    },
    {
      "path": "node_modules/@typescript/typescript-darwin-arm64",
      "name": "@typescript/typescript-darwin-arm64",
      "version": "7.0.2",
      "direct": false,
      "workspace": false,
      "development": true,
      "optional": true,
      "licenseExpression": "Apache-2.0",
      "ast": {
        "license": "Apache-2.0"
      },
      "status": "passed",
      "reasonCode": null
    },
    {
      "path": "node_modules/@typescript/typescript-darwin-x64",
      "name": "@typescript/typescript-darwin-x64",
      "version": "7.0.2",
      "direct": false,
      "workspace": false,
      "development": true,
      "optional": true,
      "licenseExpression": "Apache-2.0",
      "ast": {
        "license": "Apache-2.0"
      },
      "status": "passed",
      "reasonCode": null
    },
    {
      "path": "node_modules/@typescript/typescript-freebsd-arm64",
      "name": "@typescript/typescript-freebsd-arm64",
      "version": "7.0.2",
      "direct": false,
      "workspace": false,
      "development": true,
      "optional": true,
      "licenseExpression": "Apache-2.0",
      "ast": {
        "license": "Apache-2.0"
      },
      "status": "passed",
      "reasonCode": null
    },
    {
      "path": "node_modules/@typescript/typescript-freebsd-x64",
      "name": "@typescript/typescript-freebsd-x64",
      "version": "7.0.2",
      "direct": false,
      "workspace": false,
      "development": true,
      "optional": true,
      "licenseExpression": "Apache-2.0",
      "ast": {
        "license": "Apache-2.0"
      },
      "status": "passed",
      "reasonCode": null
    },
    {
      "path": "node_modules/@typescript/typescript-linux-arm",
      "name": "@typescript/typescript-linux-arm",
      "version": "7.0.2",
      "direct": false,
      "workspace": false,
      "development": true,
      "optional": true,
      "licenseExpression": "Apache-2.0",
      "ast": {
        "license": "Apache-2.0"
      },
      "status": "passed",
      "reasonCode": null
    },
    {
      "path": "node_modules/@typescript/typescript-linux-arm64",
      "name": "@typescript/typescript-linux-arm64",
      "version": "7.0.2",
      "direct": false,
      "workspace": false,
      "development": true,
      "optional": true,
      "licenseExpression": "Apache-2.0",
      "ast": {
        "license": "Apache-2.0"
      },
      "status": "passed",
      "reasonCode": null
    },
    {
      "path": "node_modules/@typescript/typescript-linux-loong64",
      "name": "@typescript/typescript-linux-loong64",
      "version": "7.0.2",
      "direct": false,
      "workspace": false,
      "development": true,
      "optional": true,
      "licenseExpression": "Apache-2.0",
      "ast": {
        "license": "Apache-2.0"
      },
      "status": "passed",
      "reasonCode": null
    },
    {
      "path": "node_modules/@typescript/typescript-linux-mips64el",
      "name": "@typescript/typescript-linux-mips64el",
      "version": "7.0.2",
      "direct": false,
      "workspace": false,
      "development": true,
      "optional": true,
      "licenseExpression": "Apache-2.0",
      "ast": {
        "license": "Apache-2.0"
      },
      "status": "passed",
      "reasonCode": null
    },
    {
      "path": "node_modules/@typescript/typescript-linux-ppc64",
      "name": "@typescript/typescript-linux-ppc64",
      "version": "7.0.2",
      "direct": false,
      "workspace": false,
      "development": true,
      "optional": true,
      "licenseExpression": "Apache-2.0",
      "ast": {
        "license": "Apache-2.0"
      },
      "status": "passed",
      "reasonCode": null
    },
    {
      "path": "node_modules/@typescript/typescript-linux-riscv64",
      "name": "@typescript/typescript-linux-riscv64",
      "version": "7.0.2",
      "direct": false,
      "workspace": false,
      "development": true,
      "optional": true,
      "licenseExpression": "Apache-2.0",
      "ast": {
        "license": "Apache-2.0"
      },
      "status": "passed",
      "reasonCode": null
    },
    {
      "path": "node_modules/@typescript/typescript-linux-s390x",
      "name": "@typescript/typescript-linux-s390x",
      "version": "7.0.2",
      "direct": false,
      "workspace": false,
      "development": true,
      "optional": true,
      "licenseExpression": "Apache-2.0",
      "ast": {
        "license": "Apache-2.0"
      },
      "status": "passed",
      "reasonCode": null
    },
    {
      "path": "node_modules/@typescript/typescript-linux-x64",
      "name": "@typescript/typescript-linux-x64",
      "version": "7.0.2",
      "direct": false,
      "workspace": false,
      "development": true,
      "optional": true,
      "licenseExpression": "Apache-2.0",
      "ast": {
        "license": "Apache-2.0"
      },
      "status": "passed",
      "reasonCode": null
    },
    {
      "path": "node_modules/@typescript/typescript-netbsd-arm64",
      "name": "@typescript/typescript-netbsd-arm64",
      "version": "7.0.2",
      "direct": false,
      "workspace": false,
      "development": true,
      "optional": true,
      "licenseExpression": "Apache-2.0",
      "ast": {
        "license": "Apache-2.0"
      },
      "status": "passed",
      "reasonCode": null
    },
    {
      "path": "node_modules/@typescript/typescript-netbsd-x64",
      "name": "@typescript/typescript-netbsd-x64",
      "version": "7.0.2",
      "direct": false,
      "workspace": false,
      "development": true,
      "optional": true,
      "licenseExpression": "Apache-2.0",
      "ast": {
        "license": "Apache-2.0"
      },
      "status": "passed",
      "reasonCode": null
    },
    {
      "path": "node_modules/@typescript/typescript-openbsd-arm64",
      "name": "@typescript/typescript-openbsd-arm64",
      "version": "7.0.2",
      "direct": false,
      "workspace": false,
      "development": true,
      "optional": true,
      "licenseExpression": "Apache-2.0",
      "ast": {
        "license": "Apache-2.0"
      },
      "status": "passed",
      "reasonCode": null
    },
    {
      "path": "node_modules/@typescript/typescript-openbsd-x64",
      "name": "@typescript/typescript-openbsd-x64",
      "version": "7.0.2",
      "direct": false,
      "workspace": false,
      "development": true,
      "optional": true,
      "licenseExpression": "Apache-2.0",
      "ast": {
        "license": "Apache-2.0"
      },
      "status": "passed",
      "reasonCode": null
    },
    {
      "path": "node_modules/@typescript/typescript-sunos-x64",
      "name": "@typescript/typescript-sunos-x64",
      "version": "7.0.2",
      "direct": false,
      "workspace": false,
      "development": true,
      "optional": true,
      "licenseExpression": "Apache-2.0",
      "ast": {
        "license": "Apache-2.0"
      },
      "status": "passed",
      "reasonCode": null
    },
    {
      "path": "node_modules/@typescript/typescript-win32-arm64",
      "name": "@typescript/typescript-win32-arm64",
      "version": "7.0.2",
      "direct": false,
      "workspace": false,
      "development": true,
      "optional": true,
      "licenseExpression": "Apache-2.0",
      "ast": {
        "license": "Apache-2.0"
      },
      "status": "passed",
      "reasonCode": null
    },
    {
      "path": "node_modules/@typescript/typescript-win32-x64",
      "name": "@typescript/typescript-win32-x64",
      "version": "7.0.2",
      "direct": false,
      "workspace": false,
      "development": true,
      "optional": true,
      "licenseExpression": "Apache-2.0",
      "ast": {
        "license": "Apache-2.0"
      },
      "status": "passed",
      "reasonCode": null
    },
    {
      "path": "node_modules/ajv",
      "name": "ajv",
      "version": "8.20.0",
      "direct": true,
      "workspace": false,
      "development": false,
      "optional": false,
      "licenseExpression": "MIT",
      "ast": {
        "license": "MIT"
      },
      "status": "passed",
      "reasonCode": null
    },
    {
      "path": "node_modules/ajv-formats",
      "name": "ajv-formats",
      "version": "3.0.1",
      "direct": true,
      "workspace": false,
      "development": false,
      "optional": false,
      "licenseExpression": "MIT",
      "ast": {
        "license": "MIT"
      },
      "status": "passed",
      "reasonCode": null
    },
    {
      "path": "node_modules/fast-deep-equal",